{
  "$schema": "https://json-schema.org/draft/2020-12/schema",
  "$id": "https://specdev.local/schema/15_redteam_loop.schema.json",
  "title": "15_redteam_loop",
  "type": "object",
  "additionalProperties": false,
  "properties": {
    "id": {
      "$ref": "https://specdev.local/schema/core/atoms/1#kebabId"
    },
    "owner": {
      "$ref": "https://specdev.local/schema/core/atoms/1#owner"
    },
    "created_at": {
      "$ref": "https://specdev.local/schema/core/atoms/1#timestamp"
    },
    "new_fixtures": {
      "$ref": "https://specdev.local/schema/core/collections/1#kebabIdArray"
    },
    "spec_updates": {
      "type": "array",
      "items": {
        "type": "object",
        "additionalProperties": false,
        "properties": {
          "ref": {
            "$ref": "https://specdev.local/schema/core/collections/1#traceRef"
          },
          "change": {
            "type": "string"
          },
          "reason": {
            "type": "string"
          }
        },
        "required": [
          "ref",
          "change"
        ]
      }
    },
    "redteam_status": {
      "type": "string",
      "enum": [
        "green",
        "red"
      ]
    }
  },
  "required": [
    "id",
    "owner",
    "created_at"
  ]
}