{
  "$schema": "https://specdev.local/schema/15_redteam_loop.schema.json",
  "id": "redteam-loop-core",
  "owner": "api",
  "created_at": "2025-10-17T00:00:00Z",
  "new_fixtures": [
    "fx-login-invalid"
  ],
  "spec_updates": [
    {
      "ref": {
        "type": "api",
        "id": "api-login"
      },
      "change": "Added explicit 401 error mapping",
      "reason": "Align with red-team finding"
    }
  ],
  "redteam_status": "green"
}
